{
  "id": "PROJ-20250704-environmental-science-20250704-001",
  "title": "environmental science 20250704 001",
  "description": "Migrated project: environmental-science-20250704-001",
  "field": "environmental-science",
  "status": "ready",
  "created_date": "2025-07-08T14:28:09.504Z",
  "updated_date": "2025-07-08T14:28:09.504Z",
  "contributors": [],
  "github_issues": [],
  "phases": {
    "idea": {
      "completed": false,
      "points": 0
    },
    "technical_design": {
      "completed": false,
      "points": 0
    },
    "implementation_plan": {
      "completed": false,
      "points": 0
    },
    "code": {
      "completed": false,
      "points": 0
    },
    "paper": {
      "completed": false,
      "points": 0
    }
  }
}