{
  "id": "PROJ-20250704-energy-20250704-001",
  "title": "energy 20250704 001",
  "description": "Migrated project: energy-20250704-001",
  "field": "energy",
  "status": "ready",
  "created_date": "2025-07-08T14:28:09.499Z",
  "updated_date": "2025-07-08T14:28:09.499Z",
  "contributors": [],
  "github_issues": [],
  "phases": {
    "idea": {
      "completed": false,
      "points": 0
    },
    "technical_design": {
      "completed": false,
      "points": 0
    },
    "implementation_plan": {
      "completed": false,
      "points": 0
    },
    "code": {
      "completed": false,
      "points": 0
    },
    "paper": {
      "completed": false,
      "points": 0
    }
  }
}