{
  "id": "PROJ-001-llmxive-automation-testing",
  "title": "llmxive automation testing",
  "description": "Migrated project: llmxive-automation-testing",
  "field": "robotics",
  "status": "ready",
  "created_date": "2025-07-08T14:28:09.529Z",
  "updated_date": "2025-07-08T14:28:09.529Z",
  "contributors": [],
  "github_issues": [],
  "phases": {
    "idea": {
      "completed": false,
      "points": 0
    },
    "technical_design": {
      "completed": false,
      "points": 0
    },
    "implementation_plan": {
      "completed": false,
      "points": 0
    },
    "code": {
      "completed": false,
      "points": 0
    },
    "paper": {
      "completed": false,
      "points": 0
    }
  }
}