{
  "id": "PROJ-001-gene-regulation-mechanisms-001",
  "title": "gene regulation mechanisms 001",
  "description": "Migrated project: gene-regulation-mechanisms-001",
  "field": "biology",
  "status": "in-progress",
  "created_date": "2025-07-08T14:28:09.462Z",
  "updated_date": "2025-07-08T14:28:09.462Z",
  "contributors": [],
  "github_issues": [],
  "phases": {
    "idea": {
      "completed": false,
      "points": 0
    },
    "technical_design": {
      "completed": false,
      "points": 0
    },
    "implementation_plan": {
      "completed": false,
      "points": 0
    },
    "code": {
      "completed": false,
      "points": 0
    },
    "paper": {
      "completed": false,
      "points": 0
    }
  }
}